{
  "country": "pe",
  "name_zh": "秘鲁",
  "flag": "🇵🇪",
  "region": "拉美",
  "difficulty": 2,
  "summary": "秘鲁卫生部首页已打开。化妆品注册细则和税号未核对。",
  "items": [
    {
      "id": "pe-entry",
      "name_zh": "化妆品监管入口",
      "authority": "秘鲁卫生部",
      "type": "registration",
      "mandatory": false,
      "cost": "未知",
      "time": "未知",
      "docs": [],
      "who": "进口商",
      "note": "已打开卫生部首页。药品局化妆品处室未单独打开。",
      "official_url": "https://www.gob.pe/minsa",
      "source_checked": "2026-10-24",
      "needs_review": true
    },
    {
      "id": "pe-hs",
      "name_zh": "HS 编码与关税",
      "authority": "秘鲁卫生部",
      "type": "tax-customs",
      "mandatory": true,
      "cost": "未知",
      "time": "未知",
      "docs": [],
      "who": "进口商",
      "note": "链接不是税则。税号和税率未抄录。",
      "official_url": "https://www.gob.pe/minsa",
      "source_checked": "2026-10-24",
      "needs_review": true
    }
  ],
  "steps": [
    {
      "title": "核对监管入口",
      "type": "registration"
    },
    {
      "title": "清关",
      "type": "tax-customs"
    }
  ],
  "last_verified": "2026-10-24",
  "hs_codes": {
    "status": "pending",
    "items": []
  }
}
