{
  "country": "ke",
  "name_zh": "肯尼亚",
  "flag": "🇰🇪",
  "region": "非洲",
  "difficulty": 2,
  "summary": "药房与毒药委员会首页已打开。是否主管化妆品，本次未核对。",
  "items": [
    {
      "id": "ke-entry",
      "name_zh": "监管入口待核对",
      "authority": "药房与毒药委员会",
      "type": "registration",
      "mandatory": false,
      "cost": "未知",
      "time": "未知",
      "docs": [],
      "who": "进口商",
      "note": "首页写明监管药学职业和医疗产品。化妆品是否在列，未核对。",
      "official_url": "https://web.pharmacyboardkenya.org/",
      "source_checked": "2026-10-24",
      "needs_review": true
    },
    {
      "id": "ke-hs",
      "name_zh": "HS 编码与关税",
      "authority": "药房与毒药委员会",
      "type": "tax-customs",
      "mandatory": true,
      "cost": "未知",
      "time": "未知",
      "docs": [],
      "who": "进口商",
      "note": "链接不是税则。税号和税率未抄录。",
      "official_url": "https://web.pharmacyboardkenya.org/",
      "source_checked": "2026-10-24",
      "needs_review": true
    }
  ],
  "steps": [
    {
      "title": "核对监管入口",
      "type": "registration"
    },
    {
      "title": "清关",
      "type": "tax-customs"
    }
  ],
  "last_verified": "2026-10-24",
  "hs_codes": {
    "status": "pending",
    "items": []
  }
}
