{
  "country": "in",
  "name_zh": "印度",
  "flag": "🇮🇳",
  "region": "南亚",
  "difficulty": 3,
  "summary": "进口化妆品须向 CDSCO 注册。未注册不得进口。费用未抄录。",
  "items": [
    {
      "id": "in-import",
      "name_zh": "进口化妆品注册",
      "authority": "CDSCO",
      "type": "registration",
      "mandatory": true,
      "cost": "未知",
      "time": "未知",
      "docs": [
        "在线申请材料",
        "包装规格与变体"
      ],
      "who": "进口商",
      "note": "化妆品规则 2020 第 12 条：未注册不得进口。费用未抄录。",
      "official_url": "https://cdsco.gov.in/opencms/opencms/en/Cosmetics/cosmetics/",
      "source_checked": "2026-10-24",
      "needs_review": false
    },
    {
      "id": "in-quality",
      "name_zh": "质量与安全规格",
      "authority": "CDSCO",
      "type": "safety",
      "mandatory": true,
      "cost": "未知",
      "time": "未知",
      "docs": [],
      "who": "进口商",
      "note": "不在第九表的，须符合原产国标准",
      "official_url": "https://cdsco.gov.in/opencms/opencms/en/Cosmetics/cosmetics/",
      "source_checked": "2026-10-24",
      "needs_review": false
    },
    {
      "id": "in-claim",
      "name_zh": "不得虚假宣称",
      "authority": "CDSCO",
      "type": "label",
      "mandatory": true,
      "cost": "未知",
      "time": "未知",
      "docs": [],
      "who": "进口商",
      "note": "规则第 36 条禁止虚假宣称。何谓虚假本次未展开。",
      "official_url": "https://cdsco.gov.in/opencms/opencms/en/Cosmetics/cosmetics/",
      "source_checked": "2026-10-24",
      "needs_review": true
    },
    {
      "id": "in-hs",
      "name_zh": "HS 编码与关税",
      "authority": "CDSCO",
      "type": "tax-customs",
      "mandatory": true,
      "cost": "未知",
      "time": "未知",
      "docs": [],
      "who": "进口商",
      "note": "链接不是税则。税号和税率未抄录。",
      "official_url": "https://cdsco.gov.in/opencms/opencms/en/Cosmetics/cosmetics/",
      "source_checked": "2026-10-24",
      "needs_review": true
    }
  ],
  "steps": [
    {
      "title": "进口注册",
      "type": "registration"
    },
    {
      "title": "标签",
      "type": "label"
    },
    {
      "title": "清关",
      "type": "tax-customs"
    }
  ],
  "last_verified": "2026-10-24",
  "hs_codes": {
    "status": "pending",
    "items": []
  }
}
