{
  "country": "tm",
  "name_zh": "土库曼斯坦",
  "flag": "🇹🇲",
  "region": "中亚",
  "difficulty": 2,
  "summary": "不是欧亚经济联盟成员。卫生部首页未见化妆品上市前注册或通知。",
  "items": [
    {
      "id": "tm-not-eaeu",
      "name_zh": "不能套用联盟化妆品法规",
      "authority": "欧亚经济联盟",
      "type": "platform",
      "mandatory": false,
      "cost": "未知",
      "time": "未知",
      "docs": [],
      "who": "出口商",
      "note": "现行成员名单没有土库曼斯坦，不适用ТР ТС 009/2011。",
      "official_url": "https://www.eaeunion.org/?about-info=&lang=en",
      "source_checked": "2026-10-24",
      "needs_review": false
    },
    {
      "id": "tm-gap",
      "name_zh": "未核到上市前程序",
      "authority": "卫生与医药工业部",
      "type": "registration",
      "mandatory": false,
      "cost": "未知",
      "time": "未知",
      "docs": [],
      "who": "进口商",
      "note": "首页有药品名录等服务，没有化妆品通知或注册。不编造备案路径。",
      "official_url": "https://www.saglykhm.gov.tm/",
      "source_checked": "2026-10-24",
      "needs_review": true
    }
  ],
  "steps": [
    {
      "title": "排除联盟路径",
      "type": "platform"
    },
    {
      "title": "核对卫生部",
      "type": "registration"
    }
  ],
  "last_verified": "2026-10-24",
  "hs_codes": {
    "status": "pending",
    "items": []
  }
}
